Company,Team Strength,Sector,Location
Cubical Laboratories Private Limited,500+,Smart Home Automation and Security Solutions,South West Delhi
Signzy Technologies Private Ltd.,500+,Regtech,Mumbai City
PurpleBits Infosystems Pvt Ltd,500+,Healthcare,Vadodara
Say-luss Medicare pvt ltd,500+,Healthcare,Udaipur
Rabbit and Tortoise Technology Solutions,500+,Education|Information Technology Artificial Intelligence,Pune
Smart Joules Pvt. Ltd,500+,Clean Energy Solution,North Delhi
I REE CONSTRUCTION INDIA PRIVATE LIMITED,500+,Construction and Real Estate,Thane
Indus OS,500+,Enabing Smartphones for Regional India,Mumbai City
Wimera Systems Pvt Ltd,500+,Industrial IoT,Bangalore
Invilogic Software PVT LTD,500+,Healthcare|Education|Environment Clean Tech|Clean Energy Solution|Design Automation using KBE Process,Hyderabad
Green Agrevolution Private Limited,500+,Agriculture,Gurugram
GOOFFER HYPERLOCAL PVT LTD,500+,Financial Inclusion|CLOUD,Hyderabad
IPS e Services Private Limited,500+,Financial Inclusion|e governance and e commerce using a digital platform,Mumbai City
PictureTime Digiplex Pvt Ltd,500+,Entertainment and Cinema,Gautam Buddha Nagar
Sequretek IT Solutions Pvt. Ltd.,500+,Cyber Security,Mumbai City
NetObjex (India) Pvt. Ltd.,500+,Financial Inclusion|Smart city,Thane
Budi Srinivasa Rao,500+,Agriculture,East Godavari
Budi parvathi,500+,Education,East Godavari
WiJungle,21-50,Cybersecurity,Jaipur
Geo Climate Risk Solutions Pvt Ltd,21-50,Agriculture|Infrastructure Transport|Environment Clean Tech,Visakhapatnam
WeMakeScholars Edtech Pvt Ltd,21-50,Education|Financial Inclusion,Hyderabad
LectureNotes Technologies Pvt Ltd,21-50,Education,Khordha
TechClove Technologies Pvt Ltd,21-50,E-Comm Food Tech Housing Tech,Hyderabad
Tapits Technologies Private Limited,21-50,Financial Inclusion,Indore
Inspilearn Education Private Limited,21-50,Education,Mumbai Suburban
Safal Staratup,21-50,Business Consulting,Pune
Ithink Logistics,21-50,Infrastructure Transport,Mumbai Suburban
Log 9 Materials Scientific Private Limited,21-50,Environment Clean Tech|Clean Energy Solution,Bangalore
Brishti Technologies Pvt Ltd,21-50,Education,Kolkata
IOTomation Ecotech Private Limited,21-50,Infrastructure Transport,Gautam Buddha Nagar
WiSig Networks Pvt Ltd,21-50,5G and IoT,Sangareddy
Volumetree Technology Solutions Private Limited,21-50,Healthcare|Infrastructure Transport|Environment Clean Tech,Panchkula
Calligo Technologies Pvt Ltd,21-50,Artificial Intelligence and BigData Analytics,Bangalore
Alcodex Technologies Pvt. Ltd.,21-50,Environment Clean Tech,Ernakulam
PuREnergy Pvt Ltd,21-50,Infrastructure Transport|Environment Clean Tech,Sangareddy
Pineaxe Technologies LLP,21-50,Education,Coimbatore
Mpover India Tyre eService and AMC Pvt Ltd,21-50,Tyre and Bike AMC through Digital Technology,Chennai
TrakitNow Technologies Pvt Ltd,21-50,Healthcare|Infrastructure Transport|Smart Cities,Hyderabad
Phoenix Robotix Pvt. Ltd.,21-50,Environment Clean Tech|Industrial IoT Enterprise Tech,Sundargarh
Luharia Technologies Private Limited,21-50,Financial Inclusion|Peer to Peer lending,Hyderabad
EffiaSoft Pvt. Ltd.,21-50,Financial Inclusion|Retail - Distribution - Airline - Taxation Governance,Hyderabad
Soulpage IT Solutions,21-50,Healthcare|Education|Financial Inclusion|Infrastructure Transport|Clean Energy Solution,Hyderabad
IMPACTOXGEN PRIVATE LIMITED,21-50,Financial Inclusion|FINTECH AI BIG DATA,Bangalore
Chipspirit,21-50,VLSI Design and Semiconductors,Bangalore
Legalkart,21-50,Legal Technology - Artificial Intelligence,Gurugram
CareNX Innovations Pvt. Ltd,21-50,Healthcare,Mumbai City
Acculytixs Private Limited,21-50,Artificial Intelligence and Analytics,Krishna
Pravesh,21-50,Rcmpl,Jhansi
NOVA GLOBAL DESIGN SPACE SOLUTIONS PVT LTD.,21-50,Clean Energy Solution,Bangalore
SatSure Analytics India Pvt. Ltd.,21-50,Agriculture|Financial Inclusion|Environment Clean Tech,Bangalore
anyEMI Online Services Private Limited,21-50,Financial Inclusion,Visakhapatnam
Cenacle Research India Private Limited,21-50,Healthcare|Education|Agriculture|Financial Inclusion|Infrastructure Transport|Environment Clean Tech,Krishna
Lab To Market Innovation,21-50,Infrastructure Transport|RandD In IOT And AI technologies for Railway Industries,Bangalore
Workruit,21-50,Employment Technology,Hyderabad
Optimized Electrotech Pvt Ltd,21-50,Defense Electronics,Ahmedabad
Anvation Labs Private Limited,21-50,Healthcare|Agriculture|Infrastructure Transport|Environment Clean Tech|Clean Energy Solution|Defense and Government PSU,Hyderabad
Fastech Fashions Private Limited,21-50,Textile and innovation,Sundargarh
Scalett Moose,21-50,Education|Gaming,Krishna
5C Network INDIA Pvt Ltd,21-50,Healthcare,Bangalore
TRUCKHALL PRIVATE LIMITED,21-50,Infrastructure Transport,Kolkata
Synergy Teletech Private Limited,21-50,Environment Clean Tech|Clean Energy Solution,Gautam Buddha Nagar
SenseGiz Technologies Pvt Ltd.,21-50,Industrial IoT,Belagavi
Automovill Technologies Pvt Ltd,21-50,Automobile service,Bangalore
Innovative Design and Entrepreneurship Art,21-50,Healthcare|Education|Agriculture|Infrastructure Transport,Guntur
MOBISMART CARD TECHNOLOGY P LTD,21-50,smartcard manufacturing,Kanchipuram
Aadiwasi JanJagruti,21-50,Creating social awareness and sustainable livelihood,Nandurbar
EMINENCE,21-50,Education|INFO ENTERTAINMENT,Guntur
Roushan Jan Seva,21-50,Healthcare|Education|Agriculture|Financial Inclusion,Banka
PrintSkool,21-50,Environment Clean Tech|Design and Printing and Online E-commerce,Krishna
Isthriwala Laundry Services - 7Cousins Enterprises,21-50,Clean Energy Solution|Home Services and E-Commerce,Krishna
Gamut Analytics Private Limited,21-50,Financial Inclusion|Languages and Speech AI,Pune
Grinntech Motors and Services Pvt. Ltd.,21-50,Clean Energy Solution,Chennai
Lithion Power,21-50,Environment Clean Tech|Clean Energy Solution,North West Delhi
Aviconn Solutions Pvt Ltd,21-50,Infrastructure Transport|Environment Clean Tech,Gurugram
mahananda agencies,21-50,Agriculture,Kolhapur
Emc square,21-50,Healthcare,Bangalore
EDSIX BRAINLAB PRIVATE LIMITED,21-50,Education,Chennai
jaysingh narwariya,21-50,Environment Clean Tech,Gwalior
Telebeacon Solutions Pvt Ltd,21-50,Healthcare|Education|Agriculture|Infrastructure Transport|Environment Clean Tech|Security,Hyderabad
Center of Digital Excellence (CODE) Private Limited,21-50,Preferably the Robotics Domain,Gautam Buddha Nagar
Tek Cube Pvt Ltd,21-50,Cyber Security,Hyderabad
AdstringO Software Private Limited,21-50,Information Technology,Mumbai Suburban
Inesh Smart Energy (P) Ltd,21-50,Smart Energy Meter and IOT products,Chennai
Telemo.io,11-20,cpaas|Communications,Noida
F6 Design & Training Solution,11-20,Education|Design|product development|AI & Machine Learning,Nagpur
OffCampusTest Technologies Private Limited,11-20,AI & Machine Learning,Kota
EstateMan,11-20,Real estate software,Jaipur
Codebucket solutions private limited,11-20,Healthcare|Education|Agriculture|Financial Inclusion|Environment Clean Tech,Ernakulam
Garth Holloway,11-20,Environment Clean Tech,Patna
pharos softtech pvt ltd,11-20,hospitality,Khordha
Vizara Technologies Private Limited,11-20,AR VR and Information Technology,South Delhi
Ashutosh Kumar,11-20,Infrastructure Transport,Patna
B2C Customer Service Pvt Ltd,11-20,Helpguru is home local service market place,East Delhi
iDream Education,11-20,Education,Gurugram
Constems-AI Systems Pvt Ltd,11-20,Agriculture|Manufacturing_and_Retail,Gautam Buddha Nagar
ZIROH LABS PRIVATE LIMITED,11-20,Cyber Security,Bangalore
NEXREA PRIVATE LIMITED,11-20,Healthcare|Augmented Reality-Virtual Reality and Artificial Intelligence,Hyderabad
GoFloaters A unit of SMBSure Business Solutions Private Limited,11-20,Infrastructure Transport|Ecommerce marketplace for work spaces,Chennai
PHOENIX ANALYTICS,11-20,Education|Financial Inclusion,Chittoor
Numocity Technologies,11-20,Infrastructure Transport|Environment Clean Tech,Bangalore
PROSPERITA MEDI 360 PVT LTD,11-20,Healthcare,Bangalore
muuvr,11-20,Infrastructure Transport|Truck logistics,Kamrup Metropolitan
Kitbag Tech Private Limited,11-20,Education,North West Delhi
The Solar Labs,11-20,Environment Clean Tech|Clean Energy Solution,South Delhi
PerfectFit Systems Private Limited,11-20,Ecommerce,Ernakulam
Uengage Services Private Limited,11-20,Digitisation of small businesses,Panchkula
METAPHOR NETWORKS PRIVATE LIMITED,11-20,Education,Khordha
EndureAir Systems Private Limited,11-20,Robotics - UAVs,Kanpur Nagar
Eyedentify Systems Private Limited,11-20,Infrastructure Transport,Hyderabad
Fabheads Automation,11-20,Manufacturing,Chennai
Tychee Innovations Pvt LTD,11-20,Healthcare|Education,Krishna
De corporate Consulting pvt ltd,11-20,Human resources,Panchkula
SKAAS TECHNOLOGY SOLUTIONS PRIVATE LIMITED,11-20,Education,Bangalore
Three Axis Engineering Services Pvt Ltd,11-20,Mechanical Engineering Services,Dharwad
SEMI-KSHA Semiconductors Pvt Ltd,11-20,Semiconductor Development and Services,Dharwad
Cybsky  Cyberambassador Solutions Pvt Ltd.,11-20,Digital Security,Nashik
GFF Innovations Pvt Ltd,11-20,Healthcare|Agriculture|Environment Clean Tech|Clean Energy Solution,Patiala
RAVENEYE GEOSPATIAL PRIVATE LIMITED,11-20,Infrastructure Transport|Environment Clean Tech|Geospatial Technology,Haridwar
Kritsnam Technologies Pvt. Ltd.,11-20,Environment Clean Tech,Kanpur Nagar
JBS Agro Farms Pvt LTD,11-20,Agriculture|Infrastructure Transport,Sundargarh
Howdy Ventures Private Limited,11-20,Sports and Fitness,Chennai
Shrihaas Consultancy Services,11-20,Digital marketing and consulting,Coimbatore
AlmaShines Technologies Private Limited,11-20,Education,Ahmedabad
ideez,11-20,Education,Tiruvallur
Arrelic Reliability Private Limited,11-20,Agriculture|Industrial IoT,Khordha
FINOLOGY VENTURES PRIVATE LIMITED,11-20,Education|Financial Inclusion|Business services like taxation - business formation and management - trademark services - etc,Raipur
IoTian Technologies Private Limited,11-20,Deep tech- IoT -  Artificial Intelligence,Bangalore
CamfyVision Technologies Pvt. Ltd.,11-20,Education,Bangalore
Santos Kumar Das,11-20,Healthcare|Infrastructure Transport|Environment Clean Tech|Clean Energy Solution|Smart city,Sundargarh
FYROOMS,11-20,Hospitality Company,Kolkata
Waferchips Techno Solutions Pvt Ltd,11-20,Healthcare,Kollam
Greens and more,11-20,HEALTH FOOD,Hyderabad
KloudPortal,11-20,AI powered CRM,Hyderabad
Budli Internet Private Limited,11-20,Financial Inclusion|Environment Clean Tech|ReCommerce of used gadgets,Bangalore
Healtheeliving E Solutions Pvt Ltd,11-20,Healthcare,Hyderabad
OCEO WATER PRIVATE LIMITED,11-20,Clean Energy Solution,Bangalore
Janani Foods Pvt Ltd,11-20,Agriculture,Hyderabad
Bigdatamatica Solutions Pvt Ltd,11-20,Healthcare|Education|Agriculture|Financial Inclusion|Infrastructure Transport,Hyderabad
Academy of Robotics,11-20,Robotics Ed-Tech Research,Visakhapatnam
Terminus Circuits Pvt Ltd,11-20,Off the Shelf IPs  Intellectual Property development for high speed interface serial links,Bangalore
Microscale Technology OPC pvt LTD,11-20,IT Telecom Storage Software services,Bangalore
SquadX Innovations Pvt. Ltd.,11-20,Education|IT services and Products,Gurugram
KP Factors,11-20,B2B SaaS- Retail Chain Integration,Gurugram
Robokart,11-20,Education,Mumbai City
Datacultr,11-20,Financial Inclusion,South Delhi
Zimyo,11-20,Financial Inclusion,Gurugram
OLatus Systems Private Limited,11-20,Research and Customised Product development in Electronics,Kamrup Metropolitan
Anextech Electronics Manufacturing Pvt. Ltd.,11-20,Electronics Manufacturing,Bangalore
DronaMaps Private Limited,11-20,Agriculture|Drones,Indore
Drones Tech Lab - A Unit of RC Hobbytech Solutions Pvt Ltd,11-20,Aerospace and Drone Technology,North 24 Parganas
MMRFIC TECHNOLOGY PRIVATE LIMITED,11-20,communications and radar system in millimetric wave,Bangalore
Zenida Studios,11-20,Media and Entertainment,Dehradun
EVQPoint,11-20,Clean Energy Solution,Bangalore
Ray Purifiers,11-20,Environment Clean Tech,Krishna
Cryptappz Technologies LLP,11-20,Healthcare|Industrial Automation and Instrumentation,Kolkata
SERIES 5 LABS PRIVATE LIMITED,11-20,Mass Media AR VR and Machine Learning,Bangalore
Fintech IT Solutions LLP,11-20,Financial Inclusion,Jodhpur
Chromosis Technologies Pvt Ltd,11-20,Software Development,Dharwad
TroonDx Technologies Pvt Ltd,11-20,Blockchain and Data Analytics,Chennai
Aura Education,11-20,Education,Dharwad
Tericsoft Technology Solutions Pvt Ltd.,11-20,Digital Transformation,Hyderabad
Yantranet Technologies Private Limited,11-20,Information Technology - Advertising,Visakhapatnam
ANTAR IoT Private Limited,11-20,Urban Tech,Visakhapatnam
Circle of Life Healthcare Pvt Ltd,11-20,Healthcare,New Delhi
GoBikes,11-20,Infrastructure Transport,Lucknow
Bodhi Health Education Pvt. Ltd,11-20,Healthcare|Education,Gurugram
SchoolPad Technologies Private Limited,11-20,Education,Sahibzada Ajit Singh Nagar
ATOM MOTORS,11-20,ELECTRIC AUTOMOBILE COMPANY,Guntur
Clavictor Academy Pvt. Ltd.,11-20,Education,Sundargarh
ALKHOLOCKS,11-20,Healthcare|Infrastructure Transport,Krishna
C electric automotive drives pvt ltd,11-20,Infrastructure Transport|Environment Clean Tech|Electric Vehicles,Ernakulam
Doorastha Analytics Pvt Ltd,11-20,Environment Clean Tech|Clean Energy Solution,East Delhi
Bevywise Networks,11-20,Manufacturing,Bangalore
Leisure Travels,11-20,Tourism,Kamrup Metropolitan
Dimension NXG,11-20,Education|AR VR,Thane
Pecspace India pvt ltd,11-20,Financial Inclusion,Haridwar
MSQube Technology Solutions Pvt. Ltd.,11-20,Healthcare|Environment Clean Tech|Food safety and infrastructure,Kolkata
Amazantz Solutions Private Limited,11-20,Education,Kolkata
Talento Consulting Private Limited,11-20,Education,South West Delhi
Ramalingam A,11-20,Food technology,Chennai
Happy Reliable Surgeries Pvt. Ltd.,11-20,Healthcare,Bangalore
ZMotion Autonomous Systems Private Limited,11-20,Agriculture|RandD in Defense and Civil Unmanned Aerial Systems,Bangalore
D Espat Pvt Ltd,11-20,Clean Energy Solution,Chennai
Kewiruangwang,11-20,online project,Peren
AKESTECH INFOTECH PRIVATE LIMITED,11-20,IT Software,Lucknow
SIVATEC SOLUTIONS,11-20,Software,Coimbatore
KAMBAA INCORPORATION,11-20,Agriculture|Software Development and Digital Marketing,Coimbatore
Navvinni Sports Private Limited,11-20,Sports,Medchal-Malkajgiri
Kinektec,11-20,Industrial-IoT,Panipat
MY3DSELFIE,11-20,3D Technology and 3D Printing,Kamrup Metropolitan
Openwater.in Private Limited,11-20,Environment Clean Tech,Bangalore
IDEEZ,11-20,Education,Tiruvallur
Brahmaputra Fables,11-20,Rural livelihoods and inclusion by digital technology,Kamrup Metropolitan
Ignitarium Technology Solutions Pvt. Ltd,11-20,Deep Learning - Multimedia,Ernakulam
Huwel Lifesciences Pvt. Ltd,11-20,Healthcare,Hyderabad
Unilogic Technologies Private Limited,11-20,Industrial Automation,Coimbatore
DESKNEED Science2home Pvt. Ltd.,11-20,Business Support Services,Kamrup Metropolitan
EyeROV IROV TECHNOLOGIES PVT LTD,11-20,Infrastructure Transport|Environment Clean Tech,Ernakulam
DeepSight AI Labs,11-20,Security and Safety - Video Surveillance,Bangalore
KATOMARAN TECHNOLOGY AND BUSINESS SOLUTIONS,11-20,IoT AI ML  Robotics,Coimbatore
Radome Technologies and Services Pvt Ltd,11-20,Aerospace and Defense,Bangalore
Greenturn Idea Factory Private Limited,11-20,Energy Management,Thrissur
Secundo Per Metre Online Solutions Private Limited,11-20,Automobile,Hyderabad
PlantShip,11-20,Environment Clean Tech|Green Technology,East Godavari
BYB parlour,11-20,Healthcare|BEAUTY AREA,Krishna
Betwala,11-20,Sports Affilaite,Mumbai City
MACLEC Technical Project Laboratory Pvt. Ltd.,11-20,Environment Clean Tech|Clean Energy Solution,New Delhi
Paradise Tour Travel and Allied Cargo,11-20,Financial Inclusion|Infrastructure Transport,Nainital
RIGHTMOVE COMMERCIAL PRIVATE LIMITED,11-20,Healthcare|Education|Financial Inclusion|Infrastructure Transport|Environment Clean Tech,Yavatmal
FENCER SERVICES PRIVATE LIMITED,11-20,Healthcare|IT SALES AND SERVICES,Pune
ADS And URL,11-20,Digital Marketing,North Delhi
Kaidoko Automation Solutions Pvt. Ltd,11-20,Education|AI in Psychological Technology,Gurugram
VDAI BioSec Private lImited,11-20,Healthcare|Education,Kanpur Nagar
REPARO PRIVATE LIMITED,11-20,DEFENCE AND AEROSPACE,Faridabad
Snapex Overseas - GARV Toilets,11-20,Environment Clean Tech|Water and Sanitation,Faridabad
ApnaPay,11-20,Financial Inclusion|Infrastructure Transport|Authentication and eKYC,Gautam Buddha Nagar
GEOCARTE RADAR TECHNOLOGY PVT. LTD.,11-20,Infrastructure Transport,Gandhinagar
Mizoram Consultancy Firm,11-20,Financial Inclusion|Environment Clean Tech,Aizawl
Autointelli System Pvt Ltd,11-20,Infrastructure Transport|Infrastructure automation,Chennai
Janitri Innovations Private Limited,11-20,Healthcare,Bangalore
UnivLabs Technologies Pvt Ltd,11-20,Healthcare,Gurugram
YuTu Electronics Pvt Ltd,11-20,Infrastructure Transport,Bangalore
Sastra Robotics India Private Limited,11-20,Robotics,Ernakulam
City Explorers Private Limited,11-20,Tourism and Immersive Local Experiences,New Delhi
Recubitech Private Limited,11-20,Agriculture|Environment Clean Tech,Tiruchirappalli
BookMyParts Networks Pvt. Ltd,11-20,supply chain of machine spare parts,Ahmedabad
TESTPAN INDIA PRIVATE LIMITED,11-20,Education|Infrastructure Transport,New Delhi
Amplitech Automation Private Limited,11-20,Education|Agriculture|Infrastructure Transport|Environment Clean Tech,Bhagalpur
Nara Technologies Pvt ltd OPC,11-20,Infrastructure Transport,Bangalore
Happy Adda Studios Pvt Ltd,11-20,Education,Bangalore
Vitor Healthsciences,11-20,Healthcare,Bangalore
Agsmartic,11-20,Agriculture,Gautam Buddha Nagar
Easemy Business Private Limited,11-20,Information Technology - We are Application Service Provider helping in GST Return Filing,Gurugram
Extravelmoney Technosol Private Limited,11-20,FinTech,Ernakulam
Robolab Technologies Pvt Ltd,11-20,Education|Environment Clean Tech,Pune
HOLY MARY INSTITUTE OF TECHNOLOGY & SCIENCE,11-20,Education,Medchal-Malkajgiri
AyanWorks Technology Solutions Private Limited,11-20,Healthcare|Education|Financial Inclusion,Pune
FOLIYOO TECHNOLOGIES PRIVATE LIMITED,1-10,Surface Transport|Logistics|Information Technology|software development,BALUGAON
Worksera,1-10,AI & Machine Learning,Bangalore
SHOPIVATE INDIA PVT LTD,1-10,eCommerce|Consumer Products & Devices,moradabad
Tarudhairya digital private limited,1-10,HealthTech,Patna
Consytel Life Sciences Pvt Ltd,1-10,Biotechnology|Drugs & Pharmaceuticals|AI & Machine Learning,Hyderabad
AdventureX Next Gen Innovative Technologies Private Limited,1-10,Sports|Surface Transport|Industrial Automation|Automobiles|AI & Machine Learning|BigData/Analytics|Agriculture|Advertising|AdTech|Intellectual Property Rights (IPR)|CleanTech|Technology|Safety and Security|Media & Entertainment|product development|production|Knowledge Management|electronics|Industrial Relations|Bio Fuels|Construction|Community|Human Resource Development|EduTech|Exports & Imports|AI/ML|Cybersecurity,Bhagalpur
AdventureX Next Gen Innovative Technologies Private Limited,1-10,Sports|Internet of Things|BigData/Analytics|Manufacturing|Surface Transport|AI & Machine Learning|Advertising|Agriculture|Automation|Industrial Automation|Automobiles,Bhagalpur
Amjad Ali Healthcare Private Limited,1-10,Healthcare,Patna
innovate2automate technologies Pvt Limited,1-10,AI & Machine Learning|Internet of Things,Bangalore
Prabhakar Alok,1-10,Education|Digital Marketing,Patna
Aarca Research Pvt Ltd,1-10,Healthcare,Bangalore
Diagnostics,1-10,Healthcare,Mumbai City
Vicharsity,1-10,Education,Hyderabad
Recipe Kit,1-10,Food Industry,Visakhapatnam
Agrani Foundation,1-10,Healthcare|Education|Agriculture,Patna
LIFEGRAPH BIOMEDICAL INSTRUMENTATION PVT.LTD,1-10,Healthcare,Patna
iEaon Tech Private Limited,1-10,Information Technology,Sambalpur
Weavers Touch,1-10,Handloom Product Sales,Visakhapatnam
Boscoe Solutions Private Limited,1-10,Employment and Empowerment in Rural Areas,Cuttack
SYFT Learn and Excell Private Limited,1-10,Education|Agriculture|Financial Inclusion,Khordha
WildTrails Technologies,1-10,Travel Tourism,Bangalore
Thinker Lab,1-10,Education,Kolkata
Genericure,1-10,Healthcare,Nagpur
Prakhya Solutions Pvt Ltd,1-10,Healthcare,Hyderabad
Azeedo Private Limited,1-10,Agriculture,Dhanbad
Fayette Innovations,1-10,Healthcare,Ernakulam
Yaanam Infotech Pvt. Ltd.,1-10,Financial Inclusion|Infrastructure Transport|E-commerce for commercial drivers,East Delhi
OO7 Trade International Private Limited,1-10,Financial Inclusion|Infrastructure Transport,Chennai
City Surveillance Services Pvt. Ltd,1-10,Video Analytics for Crime Prevention,Bangalore
Atlamedico TechSolutions Pvt Ltd,1-10,Healthcare,Sonbhadra
Uplink Automation,1-10,IoT Automation,Krishna
Springlr,1-10,Financial Inclusion|Travel-Advertising-AI-Video,Bangalore
Newage Analytics and Software Solutions Pvt Ltd,1-10,Education,Bangalore
ProRaptor Technologies Pvt Ltd,1-10,IoT,Thiruvananthapuram
Virtual Villa,1-10,VR for real estate,Gautam Buddha Nagar
otopark,1-10,Urban Parking Management,Mumbai City
Emertech Innovations Pvt. Ltd.,1-10,Agriculture|Emerging Technology use-cases for multiple domains,Mumbai City
NEONCUBE SOLUTIONS PVT. LTD.,1-10,ADVERTISING,Jhunjhunu
SensoVision Systems Pvt. Ltd.,1-10,Computer Vision Machine learning and AI,Bangalore
AUTOMATON ROBOTICS AND AUTOMATION PRIVATE LIMITED,1-10,Robotics and Automation,Ranchi
Abhinav Infosoft OPC Private Limited,1-10,Healthcare|Education|Agriculture|Financial Inclusion|Infrastructure Transport,Gwalior
3D-IP Semiconductors Pvt Ltd,1-10,Artificial Intelligence and Machine Learning,Bangalore
Infitore Engineering Solutions,1-10,Clean Energy Solution,Ernakulam
Droaerody Private Limited,1-10,Agriculture,Allahabad
ELECTROMOTION E-VIDYUT VEHICLES PRIVATE LIMITED,1-10,Infrastructure Transport|Environment Clean Tech,Raipur
STITHI INNOVATIONS,1-10,Healthcare,Haridwar
Teceads solutions private limited,1-10,IOT,Khordha
SandR agrobiotech,1-10,Agriculture,Kanchipuram
Neubrain,1-10,Financial Inclusion,Jaipur
Dvizira Private Limited,1-10,Robotics,mysore
Grego Recycling Pvt Ltd,1-10,Agriculture,Chennai
Rental Stay Private Limited,1-10,Student Housing,Gautam Buddha Nagar
Ohavio,1-10,Foodtech,Chennai
Ebisu Technologies Pvt Ltd,1-10,Financial Inclusion,Bangalore
ALTRASYS TECHNOLOGIES PRIVATE LIMITED,1-10,Healthcare,Cuttack
Fabulyst Private Limited,1-10,Fashion Retail,Bangalore
Kaiinos Geospatial Technologies Pvt Ltd,1-10,Education|Agriculture,Hyderabad
Xeality IT Technologies Pvt. Ltd,1-10,Financial Inclusion|Environment Clean Tech|analytics_intelligence_and_IOT,Sonipat
minto.ai,1-10,Industrial IoT and AI,Hyderabad
ZOBBS,1-10,HR placement Consultants,Bangalore
CURIA TECHNOLOGIES PRIVATE LIMITED,1-10,ARTIFICIAL INTELLIGENCE,Hyderabad
RD GROW GREEN INDIA PRIVATE LIMITED,1-10,WATER AND WASTEWATER,Kamrup Metropolitan
INROLABS PVT LTD,1-10,Robotics Artificial Intelligence Virtual Reality Internet of Things,Chennai
SmartReach.io,1-10,Automation software - Sales acceleration software,Hyderabad
LSS Event Labs Pvt Ltd,1-10,Event Management,Chennai
Augtra Technologies India Pvt LTD,1-10,Financial Inclusion|Restaurant Tech,Coimbatore
Caliche Private Limited,1-10,Oil and Gas,Kokrajhar
Atharva Technologies,1-10,Clean Energy Solution,Patna
Affosoft Technologies India Private Ltd,1-10,Healthcare,Hyderabad
MITRA Life Sciences,1-10,Healthcare,Hyderabad
Soil health monitoring System,1-10,Agriculture,Gwalior
FAVO CONSTRUCTION TECHNOLOGIES PVT. LTD.,1-10,Construction Robotics and Advanced Construction Materials,Hyderabad
Space Stories,1-10,Infrastructure Transport,Hyderabad
Viridi Industria Techno Solutions Pvt. Ltd,1-10,Clean Energy Solution|Clean air solution,Kamrup
Temperate Technologies Private Limited,1-10,Environment Clean Tech|Clean Energy Solution,Hyderabad
Xgen Technologies Private Limited,1-10,Marketplace for Coworking Space,South West Delhi
DHE4 VENTURES PRIVATE LIMITED,1-10,Healthcare|Education,Chennai
Wallflower,1-10,Art and craft,Visakhapatnam
QRide Technologies Pvt Ltd,1-10,Infrastructure Transport,Mumbai City
4MirrorTech Innovatives Pvt. Ltd.,1-10,IoT CleanTech,Bangalore
SHAs Arts n Expressions,1-10,Personalised Gifts,Visakhapatnam
SYBYLLINE ROBOTICS PRIVATE LIMITED,1-10,Education|Agriculture,Patna
OYE ORDER E-COMMERCE PVT LTD,1-10,Online Food and Products Delivery Company,Gwalior
Magnes Motors India,1-10,Infrastructure Transport,Mumbai Suburban
ONISOL SYSTEMS,1-10,Education|Website and Software Development,Gwalior
Saindur Enviro Pvt Ltd,1-10,Environment Clean Tech|Environmental Services and Products,East Khasi Hills
Antrax Labs,1-10,Infrastructure Transport|Manufacturing,Allahabad
Vytal Healthtech Pvt Ltd,1-10,Healthcare,Mumbai City
LEMONFLIP SOLUTION PVT LTD,1-10,Clean Energy Solution|Energy Harvesting and Power Mangment,Sangareddy
MinionLabs,1-10,Environment Clean Tech|Clean Energy Solution,Chennai
Wellth Solutions Pvt Ltd,1-10,Healthcare,Bangalore
DECIMALMINDS Pvt Ltd.,1-10,Education,Gautam Buddha Nagar
VenKam Technologies P Ltd,1-10,Remote Crowd Management and Analysis,Bangalore
AtFingerTip IT Innovations Pvt Ltd,1-10,Online Hotel Rooms Booking,Visakhapatnam
Krishworks Technology and Research Labs Pvt. Ltd,1-10,Education,Kolkata
Osure Care Private Limited,1-10,Healthcare,Sangareddy
EaffoCare Innovation Pvt Ltd,1-10,Healthcare,Hyderabad
VNC INDUSTRIES PRIVATE LIMITED,1-10,ELECTRIC AUTOMOTIVE VEHICLES,Hyderabad
InteliTix Solutions Private Limited,1-10,Agriculture|egovernance,Chennai
NexConnect Ventures Pvt Ltd,1-10,Education|Artisan Products,Kolkata
WordsMaya EduTech Pvt Ltd,1-10,Education,Pune
Dr. Suphiya Khan,1-10,Environment Clean Tech,Jaipur
Neelgreev systems,1-10,Retail and online platform,Hyderabad
Xplorazzi Adventures Private Limited,1-10,Retail Tech,Bangalore
